<quest_scripts xmlns:xsi="http://www.w3.org/2001/XMLSchema-instance" xsi:noNamespaceSchemaLocation="quest_script_data.xsd">
	<!--
  ~ This file is part of aion-unique.
  ~
  ~ aion-unique is free software: you can redistribute it and/or modify
  ~ it under the terms of the GNU General Public License as published by
  ~ the Free Software Foundation, either version 3 of the License, or
  ~ (at your option) any later version.
  ~
  ~ aion-unique is distributed in the hope that it will be useful,
  ~ but WITHOUT ANY WARRANTY; without even the implied warranty of
  ~ MERCHANTABILITY or FITNESS FOR A PARTICULAR PURPOSE.  See the
  ~ GNU General Public License for more details.
  ~
  ~ You should have received a copy of the GNU General Public License
  ~ along with aion-unique.  If not, see <http://www.gnu.org/licenses/>.
  -->
	<!-- http://www.aionarmory.com/search.aspx?browse=4.3.5#quests:0+2+1 -->
	<!-- Prologue handled by script -->
	<!-- Thinking Ahead handled by script-->
	<!-- Where's Rae? Handled by script.-->
	<!-- Treasure of the Deceased handled by script-->
	<!-- A Charmed Cube handled by script -->
	<!-- Teaching a Lesson handled by script -->
	<!-- Hit Them Where it Hurts handled by script -->
	<!-- Where's Rae This Time? handled by script -->
	<!-- Order of the Captain handled by script -->
	<!-- On Your Feet! -->
	<report_to id="2101" start_npc_id="203500" end_npc_id="203504"/>
	<!-- A Bloody Task -->
	<monster_hunt id="2102" start_npc_id="203504">
		<monster_infos npc_id="210364" var_id="0" max_kill="4"/>
		<monster_infos npc_id="210363" var_id="0" max_kill="4"/>
	</monster_hunt>
	<!-- The Sprigg Report -->
	<report_to id="2103" start_npc_id="203504" end_npc_id="203501"/>
	<!-- Meeting the Fruit Quota -->
	<item_collecting id="2104" start_npc_id="203502" action_item_id="700124"/>
	<!-- Sparkle and Shine -->
	<item_collecting id="2105" start_npc_id="203502"/>
	<!-- Vanar's Flattery -->
	<report_to start_npc_id="203502" end_npc_id="203517" item_id="182203106" id="2106"/>
	<!-- Return to Sender handled by script-->
	<!-- The Shinier the Better -->
	<item_collecting id="2108" start_npc_id="798037"/>
	<!-- Love in Bloom -->
	<item_collecting id="2109" start_npc_id="203532" action_item_id="700125"/>
	<!-- Idle Hands -->
	<report_to start_npc_id="203522" end_npc_id="203533" item_id="182203110" id="2110"/>
	<!-- Urd's Request -->
	<item_collecting start_npc_id="790003" id="2112"/>
	<!-- Token of a Lost Love -->
	<item_collecting start_npc_id="203534" id="2113"/>
	<!-- The Insect Problem handled by script-->
	<!-- Sap for Leather -->
	<report_to start_npc_id="203534" end_npc_id="203515" item_id="182203114" id="2115"/>
	<!-- A Treasure Map -->
	<item_collecting start_npc_id="203541" action_item_id="700139" id="2116"/>
	<!-- Food Bandits -->
	<monster_hunt start_npc_id="203540" id="2117">
		<monster_infos npc_id="210389" var_id="0" max_kill="9"/>
	</monster_hunt>
	<!-- Up to no Good -->
	<item_collecting id="2118" start_npc_id="203539"/>
	<!-- Black Opal -->
	<item_collecting start_npc_id="203541" id="2119" action_item_id="700127"/>
	<!-- A Brax Skin Rug -->
	<item_collecting start_npc_id="203542" id="2120"/>
	<!-- Checking on a Friend -->
	<report_to start_npc_id="203540" end_npc_id="203547" item_id="182203119" id="2121"/>
	<!-- Ashes to Ashes handled by script-->
	<!-- The Imprisoned Gourmet handled by script -->
	<!-- The Captain's Secret -->
	<item_collecting id="2124" start_npc_id="203548"/>
	<!-- The Robbery Plot handled by script -->
	<!-- As Much as You Can Carry -->
	<item_collecting id="2126" start_npc_id="203544" action_item_id="700129"/>
	<!-- Pearls Before Swine -->
	<item_collecting id="2127" start_npc_id="203544"/>
	<!-- A Good Tonic -->
	<item_collecting id="2128" start_npc_id="203543"/>
	<!-- Suspicious Activity -->
	<monster_hunt id="2129" start_npc_id="203552">
		<monster_infos var_id="0" npc_id="210408" max_kill="1"/>
		<monster_infos var_id="1" npc_id="210409" max_kill="1"/>
	</monster_hunt>
	<!-- A Delivery of Leather -->
	<report_to start_npc_id="203515" end_npc_id="203542" item_id="182203129" id="2131"/>
	<!-- A New Skill handled by script -->
	<!-- Azpha For Health And Well-being -->
	<item_collecting id="2133" start_npc_id="203519"/>
	<!-- Alfrigh's Request -->
	<item_collecting id="2134" start_npc_id="203543"/>
	<!-- For Love of Negi handled by script -->
	<!-- The Lost Axe handled by script -->
	<!-- A Cursed Opal -->
	<report_to start_npc_id="203539" end_npc_id="203541" id="2137"/>
</quest_scripts>
